{
  "schema_version": "1.0",
  "description": "Wallach 90-essentials data foundation. Per-essential: Wallach's stated baseline target dose (from Let's Play Doctor baseline supplement table where given), short notes, and confidence on the target. Used by dashboard/dashboard.html for coverage computation and by the agent for protocol reasoning.",
  "source_primary": "Let's Play Doctor (LPD) baseline supplement table for adults; Rare Earths element entries; DDDL condition-specific protocols. Cross-referenced against TRANSCRIPTIONS.md 90-nutrients graphic (with Niobium correction + K-form flag applied).",
  "last_updated": "2026-06-18",
  "totals": {
    "minerals": 60,
    "vitamins": 16,
    "amino_acids": 12,
    "fatty_acids": 3,
    "grand_total": 91
  },
  "notes": [
    "Wallach's 90-essentials list per his own framing is 60 + 16 + 12 + 3 = 91 (the 'D2 and D3 considered a single vitamin' note in his graphic reduces vitamins from 17 to 16, yielding 90).",
    "Vitamin K canonically = Menaquinone (K2 family) per Rare Earths book. The 90-nutrients graphic mislabels as K (Phylloquinone = K1) — graphic error per TRANSCRIPTIONS.md correction.",
    "Many trace minerals (especially rare earths) have NO Wallach-specified individual dose. His framework treats them as 'covered by plant-derived colloidal minerals (humic shale)' as a group. Such minerals show wallach_baseline_target='trace via PDM'.",
    "wallach_baseline_target uses the units specified in Wallach's LPD baseline supplement table where present. 'Unknown' means not given in the corpus locations searched."
  ],
  "categories": {
    "minerals": [
      {
        "name": "Aluminum",
        "essential_per_wallach": true,
        "wallach_baseline_target": "trace via PDM",
        "notes": "Listed in 90-essentials. Wallach treats as essential trace despite mainstream toxicity concerns at high dose.",
        "source": "Wallach framework + Beyond Tangy Tangerine / Ultimate Tangy Tangerine (Youngevity)",
        "kind": "trace_pdm",
        "wallach_stance": {
          "quote": "Many people are aware today that they need nutrient supplementation to augment their daily diets to assure their intake of the 90 essential nutrients, but are frustrated in the results they get from the huge variety of multiple vitamin/mineral programs available. Vitamins are pretty much the same in any multiple — minerals, however, are a different story: there are three basic types, and only plant-derived colloidal minerals deliver the full trace-mineral spectrum at the bioavailability the body actually uses.",
          "citation": "Rare Earths & Forbidden Cures (Wallach & Ma Lan), p. 277",
          "context": "Wallach's framework statement on the 90 essentials and why trace minerals must be sourced as a plant-derived colloidal class rather than individual metallic supplementation. This class-level stance applies to all trace elements Wallach treats as essential-but-collective; per-element quotes will be added when Wallach's corpus addresses an individual element specifically."
        }
      },
      {
        "name": "Arsenic",
        "essential_per_wallach": true,
        "wallach_baseline_target": "trace via PDM",
        "notes": "Listed in 90-essentials. Mainstream considers toxic; Wallach treats as essential trace (carpal tunnel syndrome treatment names arsenic as a cofactor).",
        "source": "Wallach framework + Beyond Tangy Tangerine / Ultimate Tangy Tangerine (Youngevity)",
        "kind": "trace_pdm",
        "wallach_stance": {
          "quote": "Many people are aware today that they need nutrient supplementation to augment their daily diets to assure their intake of the 90 essential nutrients, but are frustrated in the results they get from the huge variety of multiple vitamin/mineral programs available. Vitamins are pretty much the same in any multiple — minerals, however, are a different story: there are three basic types, and only plant-derived colloidal minerals deliver the full trace-mineral spectrum at the bioavailability the body actually uses.",
          "citation": "Rare Earths & Forbidden Cures (Wallach & Ma Lan), p. 277",
          "context": "Wallach's framework statement on the 90 essentials and why trace minerals must be sourced as a plant-derived colloidal class rather than individual metallic supplementation. This class-level stance applies to all trace elements Wallach treats as essential-but-collective; per-element quotes will be added when Wallach's corpus addresses an individual element specifically."
        }
      },
      {
        "name": "Barium",
        "essential_per_wallach": true,
        "wallach_baseline_target": "trace via PDM",
        "notes": "Rare earth, trace dose.",
        "source": "Wallach framework + Beyond Tangy Tangerine / Ultimate Tangy Tangerine (Youngevity)",
        "kind": "trace_pdm",
        "wallach_stance": {
          "quote": "Many people are aware today that they need nutrient supplementation to augment their daily diets to assure their intake of the 90 essential nutrients, but are frustrated in the results they get from the huge variety of multiple vitamin/mineral programs available. Vitamins are pretty much the same in any multiple — minerals, however, are a different story: there are three basic types, and only plant-derived colloidal minerals deliver the full trace-mineral spectrum at the bioavailability the body actually uses.",
          "citation": "Rare Earths & Forbidden Cures (Wallach & Ma Lan), p. 277",
          "context": "Wallach's framework statement on the 90 essentials and why trace minerals must be sourced as a plant-derived colloidal class rather than individual metallic supplementation. This class-level stance applies to all trace elements Wallach treats as essential-but-collective; per-element quotes will be added when Wallach's corpus addresses an individual element specifically."
        }
      },
      {
        "name": "Beryllium",
        "essential_per_wallach": true,
        "wallach_baseline_target": "trace via PDM",
        "notes": "Rare earth, trace dose.",
        "source": "Wallach framework + Beyond Tangy Tangerine / Ultimate Tangy Tangerine (Youngevity)",
        "kind": "trace_pdm",
        "wallach_stance": {
          "quote": "Many people are aware today that they need nutrient supplementation to augment their daily diets to assure their intake of the 90 essential nutrients, but are frustrated in the results they get from the huge variety of multiple vitamin/mineral programs available. Vitamins are pretty much the same in any multiple — minerals, however, are a different story: there are three basic types, and only plant-derived colloidal minerals deliver the full trace-mineral spectrum at the bioavailability the body actually uses.",
          "citation": "Rare Earths & Forbidden Cures (Wallach & Ma Lan), p. 277",
          "context": "Wallach's framework statement on the 90 essentials and why trace minerals must be sourced as a plant-derived colloidal class rather than individual metallic supplementation. This class-level stance applies to all trace elements Wallach treats as essential-but-collective; per-element quotes will be added when Wallach's corpus addresses an individual element specifically."
        }
      },
      {
        "name": "Boron",
        "essential_per_wallach": true,
        "wallach_baseline_target": "1 mg/day clinical (DDDL inner-ear protocol)",
        "wallach_clinical_doses": [
          {
            "condition": "general bone/joint/endocrine",
            "dose": "1 mg/day"
          }
        ],
        "notes": "Essential for bone metabolism + Ca/Mg retention + endocrine function (testosterone + estrogen doubled with supplementation, per Rare Earths + DDDL identical entries). See why-layer-boron-bone.md.",
        "source": "Youngevity Healthy Body Start Pak 2.5 component labels (Beyond Tangy Tangerine 2.5 + Beyond Osteo FX + Ultimate EFA Plus), summed at label-stated daily servings",
        "kind": "hbsp",
        "wallach_stance": {
          "quote": "Boron is essential for bone metabolism including efficient use of calcium and magnesium and proper function of endocrine glands (ovaries, testes, and adrenals).",
          "citation": "Dead Doctors Don't Lie (2011 edition, Wallach & Lan)",
          "context": "from the trace-mineral encyclopedia chapter"
        }
      },
      {
        "name": "Bromine",
        "essential_per_wallach": true,
        "wallach_baseline_target": "trace via PDM",
        "notes": "Halogen, trace dose.",
        "source": "Wallach framework + Beyond Tangy Tangerine / Ultimate Tangy Tangerine (Youngevity)",
        "kind": "trace_pdm",
        "wallach_stance": {
          "quote": "Many people are aware today that they need nutrient supplementation to augment their daily diets to assure their intake of the 90 essential nutrients, but are frustrated in the results they get from the huge variety of multiple vitamin/mineral programs available. Vitamins are pretty much the same in any multiple — minerals, however, are a different story: there are three basic types, and only plant-derived colloidal minerals deliver the full trace-mineral spectrum at the bioavailability the body actually uses.",
          "citation": "Rare Earths & Forbidden Cures (Wallach & Ma Lan), p. 277",
          "context": "Wallach's framework statement on the 90 essentials and why trace minerals must be sourced as a plant-derived colloidal class rather than individual metallic supplementation. This class-level stance applies to all trace elements Wallach treats as essential-but-collective; per-element quotes will be added when Wallach's corpus addresses an individual element specifically."
        }
      },
      {
        "name": "Calcium",
        "essential_per_wallach": true,
        "wallach_baseline_target": "2,000 to 5,000 mg/day (LPD baseline)",
        "wallach_clinical_doses": [
          {